id,collection,bookNumber,bookName,chapterId,hadithNumber,text,gradedBy,grade
adab961,adab,41,Al-Adab Al-Mufrad,435,961,"He also said, ""One of the slaves of the Ansar had a son whom he named Muhammad, The Ansar said, 'We will not give you the kunya of the Messenger of Allah until we have sat in the road and asked the Prophet about the Final Hour.' The Prophet (ﷺ) said, 'You have come to me to ask me about the Hour?' 'Yes,' we replied. He said, 'There is no one alive now who will see it, even if he lives a hundred years.' We said, 'A slave of the Ansar has had a son and named him Muhammad. The Ansar said, ""We will not call you by the kunya of the Messenger of Allah.""' The Prophet (ﷺ) said, 'You have done well. Call yourselves with my name, but do not use my kunya.'""",Al-Albani,Sahih
adab962,adab,41,Al-Adab Al-Mufrad,436,962,"Jabir ibn 'Abdullah reported that the Messenger of Allah, may Allah bless him and grant him peace, passed through the market, entering from part of the high part of the city and the people were on both sides of him. He passed by a dead one-eared goat and reached out and took its ear. Then he said, ""Who would like to buy this for a dirham?"" They said, ""Why would we want it when it is worthless? What would we do with it?"" He said, ""Would you like to have it?"" ""No,"" they replied. He asked them that three times and they said, ""No, by Allah! If it were alive, it would have a defect as it only has one ear. Why would we want it when it is dead?"" The Prophet said, ""By Allah, this world is less in the sight of Allah than this goat is to you.""",Al-Albani,Sahih
adab963,adab,41,Al-Adab Al-Mufrad,436,963,"Utayy ibn Damura said, ""I saw with Ubay a man who was attributing himself (in lineage) with an attribution of Jahiliyyah, so Ubay told him to bite his father's male organ and did not speak figuratively (i.e. was explicit). So his companions looked at him. He said, 'It appears that you disapprove of it.' Then he said, 'I will never show apprehension to anyone with regards to this. Verily, I heard the Prophet, may Allah bless him and grant him peace, say, ""Whomever attributes himself (in lineage) with an attribution of Jahiliyyah, then tell him to bite his father's male organ and do not speak figuratively (i.e. be explicit)."" ' """,Al-Albani,Sahih
adab964,adab,41,Al-Adab Al-Mufrad,437,964,"Abdu'r-Rahman ibn Sa'd said, ""Ibn 'Umar's foot went to sleep and a man said to him, 'Mention the person you love most.' He said, 'Muhammad.'""",Al-Albani,Da'if
adab965,adab,42,Al-Adab Al-Mufrad,438,965,"It is related that Abu Musa was with the Prophet, may Allah bless him and grant him peace, in one of the gardens of Madina. He said, ""The Prophet, may Allah bless him and grant him peace, had a twig in his hand with which he was striking the water and mud. A man came and asked for the garden to be opened, and the Prophet, may Allah bless him and grant him peace, said, 'Open it for him and give him the good news of the Garden.' I went and it was Abu Bakr, may Allah be pleased with him. I opened the gate for him and gave him the good news of the Garden. Then another man asked to be let in and the Prophet, may Allah bless him and grant him peace, said, 'Open the door and give him the good news of the Garden.' It was 'Umar, may Allah be pleased with him, and I let him in and gave him the good news of the Garden. Then yet another man asked to be let in. The Prophet had been reclining, but he then sat up and said, 'Open it for him and give him the good news of the Garden along with an affliction which will befall him ? or which will happen.' I went and it was 'Uthman, I opened the door and told him what the Prophet (ﷺ) had said. He said, 'Allah is the One who is asked for help. '""",Al-Albani,Sahih
adab966,adab,42,Al-Adab Al-Mufrad,439,966,"Salama ibn Wardan said, ""I saw Anas ibn Malik shake hands with some people and he asked me, 'And who are you?' I said, 'The mawla of the Banu Layth.' He stroked my head three times and said, 'May Allah bless you.'""",Al-Albani,Hasan
adab967,adab,42,Al-Adab Al-Mufrad,440,967,"Anas ibn Malik said, ""When the people of Yemen came, the Prophet, may Allah bless him and grant him peace, said, 'The people of Yemen have arrived and they have gentler hearts than you. They are the first to offer the handshake.'""",Al-Albani,Sahih
adab968,adab,42,Al-Adab Al-Mufrad,440,968,"Al-Bara' ibn 'Azib said, ""Part of the full greeting is to shake your brother's hand.""",,
adab969,adab,42,Al-Adab Al-Mufrad,441,969,"Ibrahim ibn Marzuq ath-Thaqafi related that his father (who had belonged to Allah ibn az-Zubayr) told him, ""'Abdullah ibn az-Zubayr sent me to his mother, Asma' bint Abi Bakr and he told her how al-Hajjaj was treating them. She made supplication for me and stroked my head. I was a young boy at that time.""",,
adab970,adab,42,Al-Adab Al-Mufrad,442,970,"Jabir ibn 'Abdullah said, ""I purchased a camel and rode it hard for a month until I reached Syria. 'Abdullah ibn Unays was there, and I sent word to him, saying, 'Jabir is at the door.' The messenger returned and said, 'Jabir ibn 'Abdullah?' 'Yes,' I replied. So 'Abdullah came out and embraced me. I said, 'A hadith reached me which I had not heard before and I feared that one of us might die.'"" He went on, ""I heard the Prophet, may Allah bless him and grant him peace, say, 'Allah will gather His slaves ? or people ? naked, uncircumcised, without anything.' We asked, 'What is meant by ""without anything""?' The Prophet (ﷺ) said, 'They will have nothing with them.' (The Prophet (ﷺ) went on,) 'They will be called by a voice that is heard from afar (and I think that he said, 'as if it was from close at hand'), saying, ""I am the King. None of the people of the Garden will enter the Garden while any of the people of the Fire are seeking him for some injustice he did to him. None of the people of the Fire will enter the Fire while any of the people of the Garden are seeking him for an injustice he did to him.""' I asked, 'How is this? We come to Allah naked and without any worldly goods?' He said, 'This applies to good actions and evil actions.'""",Al-Albani,Hasan
adab971,adab,42,Al-Adab Al-Mufrad,443,971,"`A'isha, the Umm al-Mu'minin, said, ""I did not see anyone who more resembled the Messenger of Allah, may Allah bless him and grant him peace, in manner of speaking than Fatima. When she came to him, he stood up for her, made her welcome, kissed her and had her sit in his place. When the Prophet came to her, she stood up for him, took his hand, made him welcome, kissed him, and made him sit in her place. She came to him during his final illness and he greeted her and kissed her.""",Al-Albani,Sahih
adab972,adab,42,Al-Adab Al-Mufrad,444,972,"Ibn 'Umar said, ""We were on a raid and the people fled. We said, 'How can we meet the Prophet, may Allah bless him and grant him peace, when we have run away? It has been revealed, ""unless he is withdrawing to rejoin the fight"" (8:16)."" We said, 'We will not go to Madina and then no one will see us.' Then we said, 'Perhaps we should go.' The Prophet, may Allah bless him and grant him peace, came from the Fajr prayer and we said, 'We fled.' He said, 'You are those rejoining the fight.""' We kissed his hand. He said, 'I am your group.*'""",Al-Albani,Da'if
adab973,adab,42,Al-Adab Al-Mufrad,444,973,"Abdu'r-Rahman ibn Razin said, ""We passed by az-Zubda and were told, 'There is Salama ibn al-Akwa'. I went to him and he greeted us. Then he brought out his hands and stated, 'With these two hands I offered allegiance to the Messenger of Allah, may Allah bless him and grant him peace.' He held out his palm which was as huge as a camel's foot, and we got up and kissed it.""",Al-Albani,Hasan
adab974,adab,42,Al-Adab Al-Mufrad,444,974,"Anas was asked, ""Did you touch the Prophet, may Allah bless him and grant him peace, with your hand?"" He replied, ""Yes,"" so they kissed it.",,
adab975,adab,42,Al-Adab Al-Mufrad,445,975,"Al-Wazi' ibn 'Amir said, ""We came and were told, 'That is the Messenger of Allah.' We took his hands and feet and kissed them.""",,
adab976,adab,42,Al-Adab Al-Mufrad,445,976,"Suhayb said, ""I saw 'Ali kiss the hands and feet of al-'Abbas.""",,
adab977,adab,42,Al-Adab Al-Mufrad,446,977,"Abu Mijaz said, ""Mu'awiya came while 'Abdullah ibn 'Amir and 'Abdullah ibn az-Zubayr were seated. Ibn 'Amir got up while Ibn az-Zubayr remained seated, and he was weightier of the two. Mu'awiya said, 'The Prophet, may Allah bless him and grant him peace, said, ""Whoever likes to have the slaves of Allah stand up out of respect for him should take his place in the Fire.""'""",Al-Albani,Sahih
adab978,adab,42,Al-Adab Al-Mufrad,447,978,"Abu Hurayra reported that the Prophet, may Allah bless him and grant him peace, said, ""Allah created Adam, may Allah bless him and grant him peace, and his height was 60 spans. He said, 'Go and greet those (a group of angels who were sitting down) and listen to how they answer you. It is your greeting and the greeting of your descendants.' He said, 'Peace be upon you,' and they replied, 'Peace be upon you and the mercy of Allah.' They added, 'and the mercy of Allah'. All who enter the Garden will have his form, but creation has continued to decline until now.'""",Al-Albani,Sahih
adab979,adab,42,Al-Adab Al-Mufrad,448,979,"Al-Bara' reported that the Prophet, may Allah bless him and grant him peace, said, ""Make the greeting common practice among you and you will be safe.""",Al-Albani,Hasan
adab980,adab,42,Al-Adab Al-Mufrad,448,980,"Abu Hurayra reported that the Prophet, may Allah bless him and grant him peace, said, ""You will not enter the Garden until you believe and you will not believe until you love one another. Shall I tell you something the doing of which will give you love of one another?"" ""Yes, Messenger of Allah,"" they replied. The Prophet (ﷺ) said, ""Make the greeting common practice among you.""",Al-Albani,Sahih
adab981,adab,42,Al-Adab Al-Mufrad,448,981,"Abdullah ibn 'Amr reported that the Messenger of Allah, may Allah bless him and grant him peace, said, ""Worship the All-Merciful and feed people. Make the greeting common practice among you and you will enter the Garden.""",Al-Albani,Sahih
adab982,adab,42,Al-Adab Al-Mufrad,449,982,"Bashir ibn Yasar said, ""No one preceded ? or got ahead of ? Ibn 'Umar when giving the greeting.""",Al-Albani,Sahih
adab983,adab,42,Al-Adab Al-Mufrad,449,983,"Jabir said, "" ""Someone riding should greet someone walking, and someone walking should greet someone sitting down. When there are two people walking, the better of them is the one who gives the greeting first.""",,
adab984,adab,42,Al-Adab Al-Mufrad,449,984,"Ibn 'Umar said that al-Agharr (who was a man from Muzayna and had been a Companion of the Prophet) was owed some measures of dates by a man from the Banu 'Amr ibn 'Awf who came to him many times. He said, ""I went to the Prophet, may Allah bless him and grant him peace, and he sent Abu Bakr as-Siddiq with me."" He continues, ""Everyone we met greeted us. Abu Bakr said, 'Don't you know that when people give the greeting before us, they have the reward? Give the greeting before them and you will have the reward.'""",Al-Albani,Hasan
adab985,adab,42,Al-Adab Al-Mufrad,449,985,"Abu Ayyub reported that the Messenger of Allah, may Allah bless him and grant him peace, said, ""It is not lawful for a Muslim man to separate himself from his brother for more than three days. When they meet, and one turns away and the other turns away, the better of them is the one who gives the greeting first.""",Al-Albani,Sahih
adab986,adab,42,Al-Adab Al-Mufrad,450,986,"Abu Hurayra reported that a man passed by the Messenger of Allah, may Allah bless him and grant him peace, while hew as in an assembly and said, ""Peace be upon you."" ""Ten good deeds,"" he said. Another man passed by and said, ""Peace be upon you and the mercy of Allah."" The Prophet (ﷺ) said, ""Twenty good deeds."" Then yet another man passed by and said, ""Peace be upon you and the mercy of Allah and His blessing,"" and the Prophet (ﷺ) said, ""Thirty good deeds."" Then a man in the gathering got up and did not give the greeting. The Messenger of Allah, may Allah bless him and grant him peace, said, ""How quickly your companion forgets! When one of you comes to an assembly, he should give the greeting. If he thinks he should sit down, he sits down. When he stands up, he gives the greeting. Neither is a greater duty than the other.""",Al-Albani,Sahih
adab987,adab,42,Al-Adab Al-Mufrad,450,987,"Umar said, ""I was riding behind Abu Bakr and he passed by some people. He said, 'Peace be upon you.' They said, 'Peace be upon you and the mercy of Allah.' He said, 'Peace be upon you and the mercy of Allah.' They said, 'Peace be upon you and the mercy of Allah and His blessings.' Abu Bakr said, 'Today the people have been very much better than us.'""",Al-Albani,Sahih
adab988,adab,42,Al-Adab Al-Mufrad,450,988,"A'isha reported that the Messenger of Allah, may Allah bless him and grant him peace, said, ""The Jews do not envy you for anything the way that they envy you for the salam and the Amin.""",Al-Albani,Sahih
adab989,adab,42,Al-Adab Al-Mufrad,451,989,"Anas reported that the Messenger of Allah, may Allah bless him and grant him peace, said, ""As-Salam (peace) is one of the Names of Allah Almighty which Allah has placed in the earth. Therefore give the greeting among yourselves.""",Al-Albani,Hasan
adab990,adab,42,Al-Adab Al-Mufrad,451,990,"Ibn Mas'ud said, "" They were doing the prayer with the Prophet, may Allah bless him and grant him peace, and someone said, 'Peace be upon Allah.' When the Prophet, may Allah bless him and grant him peace, finished the prayer, he said, 'Who said ""Peace be upon Allah""? Allah is Peace. Rather say, ""Greetings belong to Allah and good words and prayers. Peace be upon you, O Prophet and the mercy of Allah and His blessings. Peace be upon us and upon all the right-acting slaves of Allah. I testify that there is no god but Allah and I testify that Muhammad is His slave and Messenger.""'""",Al-Albani,Sahih
adab991,adab,42,Al-Adab Al-Mufrad,452,991,"Abu Hurayra said, ""I heard the Messenger of Allah, may Allah bless him and grant him peace, say, 'The rights a Muslim has over another Muslim are six."" He was asked, ""What are they?"" He replied, ""When he meets him, he should greet him, When he gives him an invitation, he should accept. When he asks him for advice, he should give him good counsel. When he sneezes and praises Allah, he should wish him mercy. when he is ill, he should visit him. When he dies, he should accompany him.""",Al-Albani,Sahih
adab992,adab,42,Al-Adab Al-Mufrad,453,992,"Abdu'r-Rahman ibn Shibl said that he heard the Prophet, may Allah bless him and grant him peace, said, ""The person riding should greet the person on foot. The person on foot should greet the person who is seated. The smaller group should greet the large. Whoever answers the greeting, that is for him. Whoever does not answer it, has nothing.""",Al-Albani,Sahih
adab993,adab,42,Al-Adab Al-Mufrad,453,993,"Abu Hurayra reported that the Messenger of Allah, may Allah bless him and grant him peace, said, ""The person riding greets the person walking. The person walking greets the person sitting. The small group greets the large group.""",Al-Albani,Sahih
adab994,adab,42,Al-Adab Al-Mufrad,453,994,"Jabir said, ""When two people walking meet, then the one who gives the greeting first is the better of them.""",Al-Albani,Sahih
adab995,adab,42,Al-Adab Al-Mufrad,454,995,See 993.,Al-Albani,Sahih
adab996,adab,42,Al-Adab Al-Mufrad,454,996,"Fadala reported that the Prophet, may Allah bless him and grant him peace, said, ""The person riding greets the person sitting and the small group greets the larger.""",Al-Albani,Sahih
adab997,adab,42,Al-Adab Al-Mufrad,455,997,"Ash-Sha'bi said that he met a rider and gave the greeting first. I said, ""Did you give the greeting first?"" He said, ""I saw Shurayh walking and he gave the greeting first.""",Al-Albani,Sahih
adab998,adab,42,Al-Adab Al-Mufrad,456,998,See 996.,Al-Albani,Sahih
adab999,adab,42,Al-Adab Al-Mufrad,456,999,See 996.,Al-Albani,Sahih
adab1000,adab,42,Al-Adab Al-Mufrad,457,1000,See 993.,Al-Albani,Sahih
adab1001,adab,42,Al-Adab Al-Mufrad,457,1001,"Abu Hurayra reported that the Messenger of Allah, may Allah bless him and grant him peace, said, ""The young person greets the old person, the person walking greets the person sitting down, and the small group greets the large group.""",Al-Albani,Sahih
adab1001b,adab,42,Al-Adab Al-Mufrad,458,1001b,"(sic) Abu'z-Zinad said, ""Kharija (ibn Zayd ibn Thabit) used to write on the letter of Zayd when he said the salam, 'Peace be upon you, Amir al-Mu'minin, and the mercy of Allah and His blessings and His forgiveness and the best of His prayers.""",Al-Albani,Sahih
adab1002,adab,42,Al-Adab Al-Mufrad,459,1002,"Abu Qurra al-Khurasani said, ""I saw Anas pass by us and he indicated to us with his hand that he was giving the greeting., The gesture made that clear. I saw al-Hasan using yellow dye while wearing a black turban. Asma' said, 'The Prophet, may Allah bless him and grant him peace, waved his hand to indicate the greeting to women.""",,
adab1003,adab,42,Al-Adab Al-Mufrad,459,1003,Sa'd reported that he went with 'Abdullah ibn 'Umar and al-Qasim ibn Muhammad. They stopped at place and 'Abdullah ibn az-Zubayr commanded and made a gesture of greeting to them and it was answered.,,
adab1004,adab,42,Al-Adab Al-Mufrad,459,1004,"Ata' ibn Abi Rabah said, ""They used to dislike a greeting made with the hand,"" or he said, ""He disliked greeting with the hand.""",Al-Albani,Sahih
adab1005,adab,42,Al-Adab Al-Mufrad,460,1005,"Thabit ibn 'Ubayd said, ""I came to a group which included 'Abdullah ibn 'Umar who said, 'When you greet, make it clearly audible, for it is a greeting from Allah containing great blessing.:",Al-Albani,Sahih
adab1006,adab,42,Al-Adab Al-Mufrad,461,1006,"At-Tufayl ibn Ubayy ibn Ka'b related that he used to visit 'Abdullah ibn 'Umar and would go with him to the market. He said, ""When we went to the market, 'Abdullah ibn 'Umar did not pass by any rubbish collector nor merchant nor poor person nor anyone else without greeting them.""",Al-Albani,Sahih
adab1007,adab,42,Al-Adab Al-Mufrad,462,1007,"Abu Hurayra reported that the Messenger of Allah, may Allah bless him and grant him peace, said, ""When one of you comes to a gathering, he should give the greeting. If he leaves, he should give the greeting. Neither is more of a duty than the other.""",Al-Albani,Sahih
adab1008,adab,42,Al-Adab Al-Mufrad,463,1008,"Abu Hurayra reported that the Prophet, may Allah bless him and grant him peace, said, ""When a man comes to a gathering, he should give the greeting. When he sits down and then thinks that he should leave before the gathering has broken up, he should give the greeting. Neither is more of a duty than the other.""",Al-Albani,Sahih
adab1009,adab,42,Al-Adab Al-Mufrad,464,1009,"Mu'awiya ibn Qurra said, ""My father told me, 'If you sit in a gathering expecting good to come from, but then something occurs which makes you leave, say, 'Peace be upon you,' and you will share in any good that they obtain in that gathering. There are no people who sit in a gathering and then split up without Allah having been mentioned, but that it is as if they were leaving the corpse of a donkey.'""",Al-Albani,Sahih (Mauquf)
adab1010,adab,42,Al-Adab Al-Mufrad,464,1010,"Abu Hurayra said, ""Whoever meets his brother should greet him. If a tree or wall comes between them and then he meets him, he should greet him on the other side.""",,
adab1011,adab,42,Al-Adab Al-Mufrad,464,1011,"Anas ibn Malik reported that the Companions of the Prophet, may Allah bless him and grant him peace, used to gather and they would turn towards the tree and a group of them would go to the right and a group to its left. When they met again, they would greet one another.",Al-Albani,Sahih
adab1012,adab,42,Al-Adab Al-Mufrad,465,1012,It is reported by Thabit al-Bannani that Anas used to oil his hand with scented oil in the morning for the sake of shaking hands with his brothers.,Al-Albani,Sahih
adab1013,adab,42,Al-Adab Al-Mufrad,466,1013,"Abdullah ibn 'Amr reported that a man said, ""Messenger of Allah, which aspect of Islam is best?"" He replied, ""Feeding people and greeting those you know and those you do not know.""",Al-Albani,Sahih
adab1014,adab,42,Al-Adab Al-Mufrad,467,1014,"Abu Hurayra reported that the Messenger of Allah, may Allah bless him and grant him peace, forbade people to sit in courtyards and roads. The Muslims said, ""We will not be able to avoid it. We cannot undertake it."" He said, ""If not, then give it its due."" They said, ""What is it due?"" He said, ""Lower the eye, guide the traveller, wish for mercy on the person who sneezes when he praises Allah and return the greeting.""",Al-Albani,Sahih
adab1015,adab,42,Al-Adab Al-Mufrad,467,1015,"Abu Hurayra said, ""The most miserly of people is the person who is miserly with the greeting. The one who is cheated of good is the one who does not return it. if a tree comes between you and your brother, and you are able to be the first to begin the greeting before the other person, then do it.""",,
adab1016,adab,42,Al-Adab Al-Mufrad,467,1016,"Salim, the mawla of 'Abdullah ibn 'Amr, said, ""When Ibn 'Umar was greeted, he returned it with increase. I came upon him sitting down and said, 'Peace be upon you,' and he said, 'Peace be upon you and the mercy of Allah.' Then I came another time and said, 'Peace be upon you and the mercy of Allah,; and he said, 'Peace be upon you and the mercy of Allah and His blessings.' Then I came to him another time and said, 'Peace be upon you and the mercy of Allah and His blessings,' and he said, 'Peace be upon you and the mercy of Allah and His blessings and the bet of His prayers.'""",,
adab1017,adab,42,Al-Adab Al-Mufrad,468,1017,"Abdullah ibn 'Amr ibn al-'as said, ""Do not greet anyone who drinks wine.""",,
adab1018,adab,42,Al-Adab Al-Mufrad,468,1018,"Al-Hasan said, ""There should be not sense of respect between you and a deviant person.""",Al-Albani,Sahih
adab1019,adab,42,Al-Adab Al-Mufrad,468,1019,"Ali ibn 'Abdullah was heard expressing his dislike for chess and said, ""Do not greet someone who plays it. It is a kind of gambling.""",,
adab1020,adab,42,Al-Adab Al-Mufrad,469,1020,"Ali ibn Abi Talib said, ""The Prophet, may Allah bless him and grant him peace, walked past some people who included a man who used khaluq perfume. He looked at them and gave them the greeting, but turns away from that man. The man asked, 'Have you turned away from me?' He replied, 'There is redness between your eyes.'""",Al-Albani,Hasan
adab1021,adab,42,Al-Adab Al-Mufrad,469,1021,"Muhammad ibn 'Abdullah reported that a man came to the Prophet, may Allah bless him and grant him peace, wearing a gold signet-ring on his finger. The Prophet, may Allah bless him and grant him peace, turned away from him. When the man saw his dislike of the gold, he threw the ring away. He made an iron ring and wore that. He came to the Prophet, may Allah bless him and grant him peace, who said, ""This is worse. This is the ornament of the people of the Fire."" The man went away, threw it off and put on a silver ring and the Prophet, may Allah bless him and grant him peace, did not say anything about it.""",Al-Albani,Hasan
adab1022,adab,42,Al-Adab Al-Mufrad,469,1022,"Abu Sa'id said, ""A man came from al-Bahrayn to the Prophet, may Allah bless him and grant him peace, and greeted him, but the Prophet (ﷺ) did not answer him. The man was wearing a gold ring and a silk robe. The man went away in sorrow. He complained to his wife and she said, 'Perhaps the Messenger of Allah objects to your robe and your ring. Throw them away and then go back.; he did that and then the Prophet (ﷺ) returned his greeting. he said, 'I came to you yesterday and you turned away from me.' He said, 'You had a coal of the Fire on your hand.' He said, 'I came then with any coals.' He said, 'As for what you brought, there is no one who is free from dependence on these stones. But it is the enjoyment of the life of this world.' He said, 'What should I make a ring from?' 'From silver, brass, or iron,' he replied.",Al-Albani,Da'if
