id,collection,bookNumber,bookName,chapterId,hadithNumber,text,gradedBy,grade
adab249,adab,12,Al-Adab Al-Mufrad,124,249,"Abu Hurayra said, ""These two ears of mine have heard and these two eyes of mine have seen the Messenger of Allah, may Allah bless him and grant him peace, take the palms of al-Hasan - or al-Husayn - in both his hands. His feet were on the feet of the Messenger of Allah, may Allah bless him and grant him peace. The Messenger of Allah, may Allah bless him and grant him peace, said, 'Climb up.' The boy climbed until his feet reached the chest of the Messenger of Allah, may Allah bless him and grant him peace, and then the Messenger of Allah, may Allah bless him and grant him peace, said, 'Open your mouth.' Then he kissed him and said, 'O Allah, love him for I love him!'""",Al-Albani,Da'if
adab250,adab,12,Al-Adab Al-Mufrad,125,250,"Jarir said, ""Since the time I became Muslim, the Messenger of Allah, may Allah bless him and grant him peace, never saw me without smiling at me."" The Messenger of Allah, may Allah bless him and grant him peace, said, ""A man from the best of Dhu Yaman will enter by this door whose face has been touched by an angel."" Then Jarir came in.",Al-Albani,Sahih
adab251,adab,12,Al-Adab Al-Mufrad,125,251,"A'isha said, ""I never saw the Prophet, may Allah bless him and grant him peace, laugh until I could see his uvula. He used to smile, may Allah bless him and grant him peace."" She said, ""When he saw a cloud or wind, distress could be seen in his face."" She said, ""Messenger of Allah, when people see a cloud, they rejoice, hoping that there will be rain in it. Yet when you see it, I see distress in your face."" He replied, ""'A'isha, what will assure me that there is no painful punishment in it? People have been punished by wind. Some people saw the punishment and stated, 'This is a rain cloud coming to us.'""",Al-Albani,Sahih
adab252,adab,12,Al-Adab Al-Mufrad,126,252,"Abu Hurayra reported that the Prophet, may Allah bless him and grant him peace, said, ""Laugh little. Much laughter kills the heart.""",Al-Albani,Hasan
adab253,adab,12,Al-Adab Al-Mufrad,126,253,"Abu Hurayra reported that the Prophet, may Allah bless him and grant him peace, said, ""Do not laugh a lot. Much laughter kills the heart.""",Al-Albani,Sahih
adab254,adab,12,Al-Adab Al-Mufrad,126,254,"Abu Hurayra said, ""The Prophet, may Allah bless him and grant him peace, went out to a group of his Companions who were laughing and talking. He said, 'By the One in whose hand my soul is, if you knew what I knew, you would laugh little and weep much.' Then he left and the people were weeping. Then Allah Almighty revealed to him, 'Muhammad! Why did you make My slaves despair?' The Prophet, may Allah bless him and grant him peace, said, ""Give good news, guide people and draw near to one another.'""",Al-Albani,Sahih
adab255,adab,12,Al-Adab Al-Mufrad,127,255,"Abu Hurayra said, ""When he faced someone, he faced him completely. When he turned away, he turned away completely. I have never seen anyone like him and I will never see anyone like them.""",Al-Albani,Sahih
adab256,adab,13,Al-Adab Al-Mufrad,128,256,"Abu Hurayra reported that the Prophet, may Allah bless him and grant him peace, asked Abu'l-Haytham: ""Do you have a servant?"" ""No,"" he replied. He said, ""Come to us when we get some captives."" The Prophet, may Allah bless him and grant him peace, was brought only two captives. Abu'l-Haytham came to him and the Prophet, may Allah bless him and grant him peace, said, ""Choose between them."" ""Choose for me, Messenger of Allah,"" he replied. The Prophet, may Allah bless him and grant him peace, said, ""The person who is consulted is in a position of trust. Take this one. I have seen him pray. Treat him well."" Abu'l-Haytham's wife said, ""You will not live up to the words of the Prophet, may Allah bless him and grant him peace, about him until you set him free."" ""He is free,"" he stated. The Prophet, may Allah bless him and grant him peace, said, ""Allah did not send a Prophet or khalifa but that he has two confidants: a confidant who commands him to do what is correct and forbids what is bad, and a confidant who will not fall short in corrupting you. Anyone who is protected from the evil confidant has been protected.""",Al-Albani,Sahih
adab257,adab,13,Al-Adab Al-Mufrad,129,257,"Amir ibn Dinar said, ""Ibn 'Abbas recited (this ayat), 'Consult with them about the matter.' (3:159)""",Al-Albani,Sahih
adab258,adab,13,Al-Adab Al-Mufrad,129,258,"Al-Hasan said, ""People never seek advice without being guided to the best possibility available to them."" Then he recited, ""and manage their affairs by mutual consultation."" (42:38)",Al-Albani,Sahih
adab259,adab,13,Al-Adab Al-Mufrad,130,259,"Abu Hurayra reported that the Prophet, may Allah bless him and grant him peace, said, ""Anyone who attributes words to me which I did not say should take his seat in the Fire. Anyone who gives his Muslim brother misguided advice when they consult him has betrayed them. If anyone gives a fatwa which is not firm, the wrong action of that rests on the one who gave the fatwa.""",Al-Albani,Sahih
adab309,adab,15,Al-Adab Al-Mufrad,145,309,"Salim ibn 'Abdullah said, ""I never heard 'Abdullah ever curse anything."" Salim mentioned that 'Abdullah ibn 'Umar said, ""It is not fitting for a believer to be a curser.""",Al-Albani,Hasan Sahih
adab310,adab,15,Al-Adab Al-Mufrad,145,310,"Jabir ibn 'Abdullah reported that the Messenger of Allah, may Allah bless him and grant him peace, said, ""Allah does not love the loud and coarse nor the one who shouts in the markets.""",Al-Albani,Da'if
adab311,adab,15,Al-Adab Al-Mufrad,145,311,"A'isha reported that some Jews came to the Prophet, may Allah bless him and grant him peace, and said, ""Poison ('sam' instead of 'salam') be upon you."" 'A'isha said, ""And upon you and may the curse of Allah and the anger of Allah be upon you!"" The Prophet (ﷺ) said, ""Easy, 'A'isha, you must be gentle. Beware of harshness and coarseness."" She asked, ""Didn't you hear what they said?"" He said, ""Didn't you hear what I said? I repeated it to them and what I said about them will be accepted and what they said about me will not be accepted.""",Al-Albani,Sahih
adab312,adab,15,Al-Adab Al-Mufrad,145,312,"Abdullah reported that the Prophet, may Allah bless him and grant him peace, said, ""A believer is not a defamer nor a curser nor coarse nor obscene.""",Al-Albani,Sahih
adab313,adab,15,Al-Adab Al-Mufrad,145,313,"Abu Hurayra reported that the Prophet, may Allah bless him and grant him peace, said, ""A person who is two-faced cannot be trusted.""",Al-Albani,Hasan Sahih
adab314,adab,15,Al-Adab Al-Mufrad,145,314,"Abdullah said, ""The most blameworthy thing in a believer's character is coarseness.""",Al-Albani,Sahih
adab315,adab,15,Al-Adab Al-Mufrad,145,315,"Ubayd al-Kindi al-Kufi reported that he heard 'Ali ibn Abi Talib said, ""The cursers are cursed.""",Al-Albani,Da'if
adab316,adab,15,Al-Adab Al-Mufrad,146,316,"Abu'd-Darda' reported that the Prophet, may Allah bless him and grant him peace, said, ""Those who curse will be neither witnesses nor intercessors on the Day of Rising.""",Al-Albani,Sahih
adab317,adab,15,Al-Adab Al-Mufrad,146,317,"Abu Hurayra reported that the Prophet, may Allah bless him and grant him peace, said, ""The true person must not be a curser.""",Al-Albani,Sahih
adab318,adab,15,Al-Adab Al-Mufrad,146,318,"Hudhayfa said, ""People do not curse one another without that curse coming true.""",Al-Albani,Sahih
adab319,adab,15,Al-Adab Al-Mufrad,147,319,"A'isha reported that Abu Bakr cursed one of his slaves and the Prophet, may Allah bless him and grant him peace, said, ""Abu Bakr! The cursers and the true! No, by the Lord of the Ka'ba,"" and he repeated that two or three times. That very same day Abu Bakr freed one of his slaves. The Prophet, may Allah bless him and grant him peace, came and said, ""Do not do that again (i.e. curse someone).""",Al-Albani,Sahih
adab320,adab,15,Al-Adab Al-Mufrad,148,320,"Samura reported that the Prophet, may Allah bless him and grant him peace, said, ""Do not curse one another with the curse of Allah, not the anger of Allah nor with the Fire.""",Al-Albani,Da'if
adab321,adab,15,Al-Adab Al-Mufrad,149,321,"Abu Hurayra said, ""The Messenger of Allah, may Allah bless him and grant him peace, was asked, ""Messenger of Allah, invoke a curse for us against the idolaters.' He replied, 'I was not sent as a curser. I was sent as a mercy.'""",Al-Albani,Sahih
adab322,adab,15,Al-Adab Al-Mufrad,150,322,"Himam said, ""We were with Hudhayfa when he was told, 'A man has a hadith going back to 'Uthman.' Hudhayfa said, 'I heard the Prophet, may Allah bless him and grant him peace, say, ""A mischief-maker will not enter the Garden.""'""",Al-Albani,Sahih
adab323,adab,15,Al-Adab Al-Mufrad,150,323,"Asma' bint Yazid reported that the Prophet, may Allah bless him and grant him peace, said, ""Shall I tell you who is the best of you?"" ""Yes,,"" they replied. He said, ""Those who remind you of Allah when you see them."" He went on to say, ""Shall I tell you who is the worst of you?"" ""Yes,"" they replied. He said, ""Those who go about slandering, causing mischief between friends in order to separate them, and desiring to lead the innocent into wrong action.""",Al-Albani,Hasan
adab324,adab,15,Al-Adab Al-Mufrad,151,324,"Ali ibn Abi Talib said, ""The person who says something indecent and the person who makes it known are equal as far as the wrong action is concerned.""",Al-Albani,Hasan
adab325,adab,15,Al-Adab Al-Mufrad,151,325,"Shubayl ibn 'Awf said, ""It is said, 'Whoever hears something indecent and then spreads it is like the one who originated it.'""",Al-Albani,Sahih
adab326,adab,15,Al-Adab Al-Mufrad,151,326,"Ata thought that an exemplary punishment should be carried out on anyone who makes adultery known. He said, ""He has made indecency known.""",Al-Albani,Sahih
adab327,adab,15,Al-Adab Al-Mufrad,152,327,"Hukaym ibn Sa'd heard 'Ali say, ""Do not be hasty, spreading and divulging secrets. Ahead of you lies a severe, distressing affliction and events which would take a long time explain - namely oppressive conflicts.""",Al-Albani,Sahih
adab328,adab,15,Al-Adab Al-Mufrad,152,328,"Ibn 'Abbas said, ""When you want to mention your companion's faults, remember your own faults.""",Al-Albani,Da'if
adab329,adab,15,Al-Adab Al-Mufrad,152,329,"Ibn 'Abbas spoke about the words of Allah Almighty, ""Do not find fault with one another"" (49:11) and he said that these words mean, ""Do not attack one another.""",Al-Albani,Da'if
adab330,adab,15,Al-Adab Al-Mufrad,152,330,"Ad-Dahhak said, ""It was about us (the Banu Salima) that these words were revealed, 'Do not find fault with one another' (49:11)"" He went on to say, ""The Messenger of Allah, may Allah bless him and grant him peace, came to us and there was not a man among us who did not have two names. The Prophet, may Allah bless him and grant him peace, began to say, 'O so-and-so!' and they said, 'Messenger of Allah! That will make him angry!'""",Al-Albani,Sahih
adab331,adab,15,Al-Adab Al-Mufrad,152,331,"Ikrima was heard to say, ""I do not know which o f them, either Ibn 'Abbas or Ibn 'Umar, was giving his companions food, and a slavegirl was working in their presence. One of them said to her, 'Harlot!' He said, 'Easy! If she does not exact the hadd punishment (i.e. for slander) from you in this world, she will take it from you in the Next World.' The man said, 'And what do you think if it (what I said) is the truth?' He replied, 'Allah does not love anyone who greatly exceeds the sounds in speaking of indecencies.""",Al-Albani,Hasan
adab332,adab,15,Al-Adab Al-Mufrad,152,332,"Abdullah reported that the Prophet, may Allah bless him and grant him peace, said. ""The believer is neither a defamer nor a curser nor outrageous nor obscene.""",Al-Albani,Sahih
adab333,adab,16,Al-Adab Al-Mufrad,153,333,"Abu Bakr reported that a man was mentioned in the presence of the Prophet, may Allah bless him and grant him peace, and someone praised him. The Prophet, may Allah bless him and grant him peace, said, ""Woe to you! You have cut off the head of your companion!"" and he repeated that several times. He went on, ""If one of you must praise someone, he should say, 'I consider that so-and-so is such-and-such.' Allah is the One who will take account of him if he thinks that he is indeed like that, No one can appropriate Allah's right to attest to someone's character.""",Al-Albani,Sahih
adab334,adab,16,Al-Adab Al-Mufrad,153,334,"Abu Musa reported that the Prophet, may Allah bless him and grant him peace, heard a man praise another man and he was using exaggeration in his praise of him. The Prophet, may Allah bless him and grant him peace, said, ""You have destroyed - or broken - the man's back.""",Al-Albani,Sahih
adab335,adab,16,Al-Adab Al-Mufrad,153,335,"Ibrahim at-Taymi reported that his father said, ""We were sitting with 'Umar and one man praised another man to his face."" He said, ""You have wounded the man. May Allah wound you.""",Al-Albani,Hasan
adab336,adab,16,Al-Adab Al-Mufrad,153,336,"Zayd ibn Aslam reported that his father heard 'Umar state, ""Praise is slaughter."" The transmitter added, ""He meant when it is accepted.""",Al-Albani,Sahih
adab337,adab,16,Al-Adab Al-Mufrad,154,337,"Abu Hurayra reported that the Prophet, may Allah bless him and grant him peace, said, ""The best of men is Abu Bakr. The best of men is 'Umar. The best of men is Abu 'Ubayda. The best of men is Usayd ibn Hudayr. The best of men is Thabit ibn Qays ibn Shammas. The best of men is Mu'adh ibn 'Amr ibn al-Jamuh. The best of men is Mu'adh ibn Jabal."" Then he said, ""The worst of men is so-and-so. The worst of men is so-and-so,"" until he had named seven men.",Al-Albani,Sahih
adab338,adab,16,Al-Adab Al-Mufrad,154,338,"A'isha said, ""A man asked permission to come to the Messenger of Allah, may Allah bless him and grant him peace, and the Messenger of Allah said, 'He is an evil son of his tribe.' When the man came in, the Prophet was courteous and cheerful towards him. When that man left, another man asked permission to come in. He said, 'He is an excellent son of his tribe.' When he came in, he was not cheerful towards him as he had been cheerful towards the other man. When he left, I said, 'Messenger of Allah, you said what you said about so-and-so and yet you were courteous to him. You said what you said about so-and-so and I did not see you do the same.' He said, ''A'isha, the worst of people are those who are feared on account of their bad language.'""",,
adab339,adab,16,Al-Adab Al-Mufrad,155,339,"Abu Ma'mar said, ""A man began to praise one of the amirs. Al-Miqdad began to throw dirt in his face and said, 'The Messenger of Allah, may Allah bless him and grant him peace, commanded us to throw dust into the faces of those who praise people.'""",Al-Albani,Sahih
adab340,adab,16,Al-Adab Al-Mufrad,155,340,"Ata' ibn Abi Rabah reported that a man was praising another man in the presence of Ibn 'Umar. Ibn 'Umar began to throw dust towards his mouth. He said, ""The Messenger of Allah, may Allah bless him and grant him peace, said, 'When you see those who praise people, throw dust in their faces.'""",Al-Albani,Sahih
adab341,adab,16,Al-Adab Al-Mufrad,155,341,"Raja' said. ""One day Mihjan and I went to the mosque of the people of Basra. Burayda al-Aslami was sitting there by one of the mosque doors. Inside the mosque there was a man called Sabka who used to make the prayers long. We came to the mosque door which had a fringed woollen cloth over it. Now Burayda was someone who made jokes. He said, 'Mihjan, don't you pray as Sabka prays?' Mihjan did not answer and went back. Mihjan said, 'The Messenger of Allah, may Allah bless him and grant him peace, once took me by the hand and we went together to the top of Uhud. He looked down on Madina and said, ""Woe to a town whose people will abandon it when it becomes very prosperous. Then the Dajjal will come to it and find two angels at each of its gates, so he will not enter it."" Then he went down until we reached the mosque and the Messenger of Allah, may Allah bless him and grant him peace, saw a man praying, prostrating and bowing. The Messenger of Allah, may Allah bless him and grant him peace, asked me, ""Who is this?"" and I began to praise him, saying, ""Messenger of Allah, this is so-and-so and so-and-so."" ""Stop!"" he said, ""Do not let him hear or you will destroy him.""'""",Al-Albani,Hasan
adab342,adab,16,Al-Adab Al-Mufrad,156,342,"Al-Aswad ibn Suray' said, ""I came to the Prophet, may Allah bless him and grant him peace, and said, 'Messenger of Allah, I have praised Allah and you in poems of praise and eulogies.' He said, 'As far as your Lord is concerned, He must be praised,' and so I began to recite them. Then a tall bald man asked for permission to enter. The Prophet, may Allah bless him and grant him peace, told me, 'Be silent.' The man came in and spoke for a time and then left. Then I recited again. Then the other man came back and he made be silent again. Then the man left again. That happened two or three times. I asked, 'Who is this man for whom I must be silent?' He replied, 'This is a man who does not like vain things.'""",,
adab343,adab,16,Al-Adab Al-Mufrad,157,343,"Abu Nujayd said, ""A poet came to 'Imran ibn Husayn and 'Imran gave him something. 'Imran was asked, 'You give to a poet?' He said, 'I am preserving my reputation (from his satire).'""",Al-Albani,Da'if
adab344,adab,17,Al-Adab Al-Mufrad,158,344,"Ibn 'Awn reported, ""They used to say, 'Do not honour your guest in a way which will be burdensome for him.'""",,
adab345,adab,17,Al-Adab Al-Mufrad,159,345,"Abu Hurayra reported that the Prophet, may Allah bless him and grant him peace, said, ""When a man visits his brothers, Allah tells him, 'You have been good and your evening will be good and you can take your place in the Garden.'""",Al-Albani,Hasan
adab346,adab,17,Al-Adab Al-Mufrad,159,346,"Umm ad-Darda' said, ""Salman came from al-Mada'in (Ctesiphon) to Syria to visit us on foot wearing a shirt (kisa') and trousers."" Shawdhab said, ""Salman was seen wearing a short with all his hair shaved off and his large ears showing. He was told, 'You have made yourself ugly.' He replied, ""The real good is the good of the Next World.'""",Al-Albani,Hasan
adab347,adab,17,Al-Adab Al-Mufrad,160,347,"Anas ibn Malik reported that the Messenger of Allah, may Allah bless him and grant him peace, visited one of the houses of the Ansar and ate some food with them. When he left, he asked for a place in the house and some water was sprinkled on a carpet for him. He prayed on it and made supplication for them.",Al-Albani,Sahih
adab348a,adab,17,Al-Adab Al-Mufrad,160,348a,"Abdulkarim Abu Umuyyah came to Abu Al'aliyah and on him were wool clothes. So Abu Al'aliyah said ""These are but the clothes of monks, as the Muslims, when visiting each other, would beautify themselves.‏""",,
adab348b,adab,17,Al-Adab Al-Mufrad,160,348b,"Abdullah, the client of Asma', said, ""Asma' brought out to me a cloak of Tayalisah (a type of mantle) which had a collar border a span (wide) of brocade and verily it's two openings were hemmed with it (i.e. brocade). She said, 'This is the of the cloak of the Messenger of Allah, may Allah bless him and grant him peace. He used to wear it for delegations and on Jumu'a.' """,,
adab349,adab,17,Al-Adab Al-Mufrad,160,349,"Abdullah ibn 'Umar said, ""'Umar found a silk robe and brought it to the Prophet, may Allah bless him and grant him peace, and said, 'Buy this and wear it on Jumu'ah and when delegations come to you.' The Prophet, peace be upon him, replied, 'Only someone who has no portion in the Next World wears this.' Then the Messenger of Allah, may Allah bless him and grant him peace, was brought some robes and sent one robe to 'Umar, one to Usama, and one to 'Ali. 'Umar said, 'Messenger of Allah! You have sent this to me when I heard you say what you said about it.' The Prophet, may Allah bless him and grant him peace, said, 'You can sell it or take care of your needs with it.'""",Al-Albani,Sahih
adab350,adab,17,Al-Adab Al-Mufrad,161,350,"Abu Hurayra reported that the Prophet, may Allah bless him and grant him peace, said, ""A man visited a brother of his in a village, so Allah put an angel in wait for him on the road. He asked, 'Where are you going?' He replied, 'To a brother of mine in this village.' He said, 'Is he responsible for some blessing you have?' He said, 'No, I love him for Allah.' He said, 'I am a messenger of Allah to you. Allah loves you as you love him.'""",Al-Albani,Sahih
adab351,adab,17,Al-Adab Al-Mufrad,162,351,"Abu Dharr said, ""I asked, 'Messenger of Allah, what if a man loves a people but cannot join them?' He replied, 'Abu Dharr, you are with the one you love.' I said, 'I love Allah and His Messenger.' He said, 'Abu Dharr, you are with the one you love.'""",Al-Albani,Sahih
adab352,adab,17,Al-Adab Al-Mufrad,162,352,"Anas reported that a man asked the Prophet, may Allah bless him and grant him peace, ""Prophet of Allah, when will the Final Hour come?"" He said, ""Have you not made preparation for it?"" He replied, "" I am not prepared for a terrible event , but I love Allah and His Messenger."" He said, ""A man is with the one he loves.""",Al-Albani,Sahih
adab353,adab,18,Al-Adab Al-Mufrad,163,353,"Abu Hurayra reported that the Prophet, may Allah bless him and grant him peace, said, ""Anyone who does not show mercy to our children nor acknowledge the right of our old people is not one of us.""",Al-Albani,Sahih
adab354,adab,18,Al-Adab Al-Mufrad,163,354,"Abdullah ibn 'Amr ibn al-'As reported that it reached him that the Prophet, may Allah bless him and grant him peace, said, ""Anyone who does not show mercy to our children nor acknowledge the right of our old people is not one of us.""",Al-Albani,Sahih
adab355,adab,18,Al-Adab Al-Mufrad,163,355,The same from 'Amr ibn Shu'ayb.,Al-Albani,Sahih
adab356,adab,18,Al-Adab Al-Mufrad,163,356,The same from Abu Umama.,Al-Albani,Hasan Sahih
adab357,adab,18,Al-Adab Al-Mufrad,164,357,"Al-Ash'ari said, ""Part of respect for Allah is to show respect to an old Muslim and to someone who knows the Qur'an, as long as he does not go to excess in it nor turn away from it, and to respect a just ruler.""",Al-Albani,Hasan
adab358,adab,18,Al-Adab Al-Mufrad,164,358,Same as 354.,Al-Albani,Sahih
adab359,adab,18,Al-Adab Al-Mufrad,165,359,"Rafi' ibn Khudayj and Sahl ibn Abi Hathama reported that 'Abdullah ibn Sahl and Muhayyisa ibn Mas'ud came to Khaybar and parted when they were among the palm trees. 'Abdullah ibn Sahl was murdered. 'Abdu'r-Rahman ibn Sahl and Huwayyisa and Muhayyisa, the sons of Mas'ud came to the Prophet, may Allah bless him and grant him peace, and spoke to him about their (murdered) companion. 'Abdu'r-Rahman, the youngest of those present, began to speak, but the Prophet, may Allah bless him and grant him peace, said, ""Let the oldest speak first."" (or ""Exalt the eldest."") They spoke about their companion and the Prophet, may Allah bless him and grant him peace, asked, ""Will fifty of you take an oath that you are entitled to the blood-money of your murdered man?"" They replied, ""Messenger of Allah, this is something which we did not see."" He said, ""Then will the Jews exonerate themselves by the oaths of fifty of them?"" They protested, ""Messenger of Allah, they are unbelievers!"" So the Messenger of Allah, may Allah bless him and grant him peace, himself paid his blood money.""",Al-Albani,Sahih
adab360,adab,18,Al-Adab Al-Mufrad,166,360,"Ibn 'Umar said, ""The Messenger of Allah, may Allah bless him and grant him peace, said, 'Tell me which tree is like the Muslim? It gives fruits at all times by the permission of its Lord and its leaves do not fall.' It occurred to me that it was the palm tree, but I did not want to speak as Abu Bakr and 'Umar, may Allah be pleased with them, were both present. When they did not speak, the Prophet, may Allah bless him and grant him peace, said, 'It is the palm tree.' When I left with my father, I said, 'Father, I thought that it was the palm,.' He asked, 'What kept you from saying that? If you had said so, I would have preferred that to such-and-such.' I said, 'What kept me from doing so was that I did not see you or Abu Bakr speak, so I did not like to speak out.'""",Al-Albani,Sahih
adab361,adab,18,Al-Adab Al-Mufrad,167,361,"Hakim ibn Qays ibn 'Asim reported that when his father was dying, he enjoined his sons: ""Fear Allah and make the oldest among you your leaders. When people make the oldest among them their leaders, they follow their fathers. When they make the youngest among them their leaders, that lowers them in the sight of their peers. You must have wealth and use it well. It is an impetus for the generous and it will make you independent of critics. Beware of asking people. It is a man's last source of earning. When I die, do not wail. There was no wailing for the Messenger of Allah, may Allah bless him and grant him peace. When I die, bury me in a land where the Bakr ibn Wa'il will not know where I am buried. I used to waylay on the roads in the time of the Jahiliyya.""",Al-Albani,Hasan
adab362,adab,19,Al-Adab Al-Mufrad,168,362,"Abu Hurayra said, ""When the Messenger of Allah, may Allah bless him and grant him peace, was brought new dates, he said, 'O Allah! Bless us in our city and in our mudd and sa', blessing upon blessing.' Then he would give one to the youngest of the children with him.""",Al-Albani,Sahih
adab363,adab,19,Al-Adab Al-Mufrad,169,363,"Amr ibn Shu'ayb reported from his grandfather that the Messenger of Allah, may Allah bless him and grant him peace, said, ""Anyone who does not show mercy to our children nor acknowledge the right of our old people is not one of us.""",Al-Albani,Sahih
