id,collection,bookNumber,bookName,chapterId,hadithNumber,text,gradedBy,grade
adab1,adab,1,Al-Adab Al-Mufrad,1,1,"Abu 'Amr ash-Shaybani said, ""The owner of this house (and he pointed at the house of 'Abdullah ibn Mas'ud) said, ""I asked the Prophet, may Allah bless him and grant him peace, which action Allah loves best. He replied, 'Prayer at its proper time.' 'Then what?' I asked. He said, 'Then kindness to parents."" I asked, 'Then what?' He replied, 'Then jihad in the Way of Allah.'"" He added, ""He told me about these things. If I had asked him to tell me more, he would have told me more.""",Al-Albani,Sahih
adab2,adab,1,Al-Adab Al-Mufrad,1,2,"Abdullah ibn 'Umar said, ""The pleasure of the Lord lies in the pleasure of the parent. The anger of the Lord lies in the anger of the parent.""",,
adab3,adab,1,Al-Adab Al-Mufrad,2,3,"Bahz ibn Hakim's grandfather said, ""I asked, 'Messenger of Allah, to whom should I be dutiful?' 'Your mother,' he replied. I asked, 'Then whom?' 'Your mother,' he replied. I asked, 'Then whom?' 'Your mother,' he replied. I asked, 'Then to whom should I be dutiful?' 'Your father,' he replied, 'and then the next closest relative and then the next.'""",Al-Albani,Hasan
adab4,adab,1,Al-Adab Al-Mufrad,2,4,"Ata' ibn Yasar said that a man came to Ibn 'Abbas and said, ""I asked a woman to marry me and she refused to marry me. Another man asked her and she agreed to marry him. I became jealous and killed her. Is there any way for me to repent?"" He asked, ""Is your mother alive?"" ""No,"" he replied. He said, ""repent to Allah Almighty and try to draw near Him as much as you can."" So I went and asked Ibn `Abbas why he inquired about the man's mother. He replied: ""I don't know of a deed closer to Allah, Exalted and Majestic, other than dutifulness to the mother.""",Al-Albani,Sahih
adab5,adab,1,Al-Adab Al-Mufrad,3,5,"Abu Hurayra said, ""The Prophet (ﷺ) was asked, 'Messenger of Allah, to whom should I be dutiful?' 'Your mother,' he replied. He was asked, 'Then whom?' 'Your mother,' he replied. He was asked, 'Then whom?' 'Your mother,' he replied. He was asked, 'Then whom?' He replied, 'Your father.'""",Al-Albani,Sahih
adab6,adab,1,Al-Adab Al-Mufrad,3,6,"Abu Hurayra reported: ""A man came to the Prophet (ﷺ) of Allah, may Allah bless him and grant him peace, and asked, 'What do you command me to do?' He replied, 'Be dutiful towards your mother.' Then he asked him the same question again and he replied, 'Be dutiful towards your mother.' He repeated it yet again and the Prophet (ﷺ) replied, 'Be dutiful towards your mother.' Then he put the question a fourth time and the Prophet (ﷺ) said, 'Be dutiful towards your father.'""",Al-Albani,Sahih
adab7,adab,1,Al-Adab Al-Mufrad,4,7,"Ibn 'Abbas said, ""If any Muslim obeys Allah regarding his parents, Allah will open two gates of the Garden for him. If there is only one parent, then one gate will be opened. If one of them is angry, then Allah will not be pleased with him until that parent is pleased with him."" He was asked, ""Even if they wrong him?"" ""Even if they wrong him"" he replied.",Al-Albani,Da'if
adab8,adab,1,Al-Adab Al-Mufrad,5,8,"Taysala ibn Mayyas said, ""I was with the Najadites [Kharijites] when I committed wrong actions which I supposed were major wrong actions. I mentioned that to Ibn 'Umar. He inquired, 'What are they?"" I replied, 'Such-and-such.' He stated, 'These are not major wrong actions. There are nine major wrong actions. They are: associating others with Allah, killing someone, desertion from the army when it is advancing, slandering a chaste woman, usury, consuming an orphan's property, heresy in the mosque, scoffing, and causing one's parents to weep through disobedience.' Ibn 'Umar then said to me, 'Do you wish to separate yourself from the Fire? Would you like to enter Paradise?' 'By Allah, yes!' I replied. He asked, 'Are your parents still alive?' I replied, 'My mother is.' He said, 'By Allah, if you speak gently to her and feed her, then you will enter the Garden as long as you avoid the major wrong actions.'""",Al-Albani,Sahih
adab9,adab,1,Al-Adab Al-Mufrad,5,9,"Hisham ibn 'Urwa related this ayat from his father, ""Take them under your wing, out of mercy, with due humility."" (17:24)",Al-Albani,Sahih
adab10,adab,1,Al-Adab Al-Mufrad,6,10,"Abu Hurayra reported that the Prophet, may Allah bless him and grant him peace, said, ""A child cannot repay his father unless he finds him as a slave and the buys him and sets him free.""",Al-Albani,Sahih
adab11,adab,1,Al-Adab Al-Mufrad,6,11,"Sa'id ibn Abi Burda said, ""I heard my father say that Ibn 'Umar saw a Yamani man going around the House while carrying his mother on his back, saying, 'I am your humble camel. If her mount is frightened, I am not frightened.' Then he asked, 'Ibn 'Umar? Do you think that I have repaid her?' He replied, 'No, not even for a single groan.'",Al-Albani,Sahih
adab12,adab,1,Al-Adab Al-Mufrad,6,12,"Marwan used to make Abu Hurayra his agent and he used to be located in Dhu'l-Hulayfa. His mother was in one house and he was in another. When he wanted to go out, he would stop at her door and say, ""Peace be upon you, mother, and the mercy of Allah and His blessing."" She would reply, ""And peace be upon you, my son, and the mercy of Allah and His blessing."" Then he said, ""May Allah have mercy on you as you raised me when I was a child."" She answered, ""May Allah have mercy on you as you were dutiful to me when I was old."" Whenever he wanted to go inside, he would do something similar.",Al-Albani,Da'if
adab13,adab,1,Al-Adab Al-Mufrad,6,13,"Abdullah ibn 'Amr said, ""A man came to the Prophet, may Allah bless him and grant him peace, and made a pledge to him that he would do hijra. He left his parents who were in tears. The Prophet (ﷺ) said, 'Go back to them and make them laugh as you made them weep.'""",Al-Albani,Sahih
adab14,adab,1,Al-Adab Al-Mufrad,6,14,"Abu Hazim reported that Abu Murra, the mawla of Umm Hani' bint Abi Talib had told him that he rode with Abu Hurayra to his land in al-'Aqiq. When he entered his land, he shouted out in his loudest voice, ""Peace be upon you, mother, and the mercy of Allah and His blessing!"" She replied, ""And peace be upon you and the mercy of Allah and His blessing."" He said, ""May Allah have mercy on you as you raised me when I was a child."" She replied, ""My son, may Allah repay you well and be pleased with you as you were dutiful towards me when I was old.""",Al-Albani,Hasan
adab15,adab,1,Al-Adab Al-Mufrad,7,15,"Abu Bakra reported that the Messenger of Allah, may Allah bless him and grant him peace, said, ""Shall I tell you which is the worst of the major wrong actions?"" ""Yes, Messenger of Allah,"" they replied. He said, ""Associating something else with Allah and disobeying parents."" He had been reclining but then he sat up and said, ""and false witness."" Abu Bakra said, ""He continued to repeat it until I said, 'Is he never going to stop?'""",Al-Albani,Sahih
adab16,adab,1,Al-Adab Al-Mufrad,7,16,"Warrad, the scribe of al-Mughira ibn Shu'ba, said, ""Mu'awiya wrote to al-Mughira, saying, 'Write down for me what you heard the Messenger of Allah, may Allah bless him and grant him peace, say.'"" Warrad said, ""He dictated to me and I wrote out, 'I heard him forbid asking too many questions, wasting money and chit-chat.'""",Al-Albani,Sahih
adab17,adab,1,Al-Adab Al-Mufrad,8,17,"Abu't-Tufayl said, ""'Ali was asked, 'Did the Prophet, may Allah bless him and grant him peace, give you something special which he did not give to anyone else?' He replied, 'The Messenger of Allah, may Allah bless him and grant him peace, did not give me anything special which he did not give to everyone else except for what I have in my sword scabbard.' He brought out a piece of paper. Written on that paper was: 'Allah curses anyone who sacrifices an animal to something other than Allah. Allah curses anyone who steals a milestone. Allah curses anyone who curses his parents. Allah curses anyone who gives shelter to an innovator.'""",Al-Albani,Sahih
adab18,adab,1,Al-Adab Al-Mufrad,9,18,"Abu'd-Darda' said, ""The Messenger of Allah, may Allah bless him and grant him peace, recommended nine things to me: 'Do not associate anything with Allah, even if you are cut to pieces or burned. Do not abandon a prescribed prayer deliberately. Anyone who abandons it will forfeit Allah's protection. Do not drink wine - it is the key to every evil. Obey your parents. If they command you to abandon your worldly possessions, then leave them for them. Do not contend with those in power, even if you think that you are in the right. Do not run away from the army when it advances, even if you are killed while your companions run away. Spend on your wife out of your means. Do not raise a stick against your wife. Cause your family to fear Allah, the Almighty and Exalted.'""",Al-Albani,Hasan
adab19,adab,1,Al-Adab Al-Mufrad,9,19,"Abdullah ibn 'Amr said, ""A man came to the Prophet, may Allah bless him and grant him peace, and said, 'I have come to make you a pledge that will do hijra although I have left my parents in tears."" The Prophet (ﷺ) said, 'Go back to them and make them laugh as you made them cry.'""",Al-Albani,Sahih
adab20,adab,1,Al-Adab Al-Mufrad,9,20,"Abdullah ibn 'Amr said, ""A man came to the Prophet, may Allah bless him and grant him peace, wanting to do jihad. The Prophet (ﷺ) asked, 'Are your parents alive?' 'Yes,' he replied. he said, 'Then exert yourself on their behalf.'""",Al-Albani,Sahih
adab21,adab,1,Al-Adab Al-Mufrad,10,21,"Abu Hurayra reported that the Prophet, may Allah bless him and grant him peace, said, ""May his nose be dusted (i.e. may he be disgraced), may his nose be dusted, may his nose be dusted."" They said, ""Messenger of Allah, who?"" He said, ""The one who lives to see his parents or one of them in old age, and (still) enters the Fire.""",Al-Albani,Sahih
adab22,adab,1,Al-Adab Al-Mufrad,11,22,"Mu'adh said, ""Bliss belongs to someone who is dutiful towards his parents. Allah Almighty will prolong his life.""",Al-Albani,Da'if
adab23,adab,1,Al-Adab Al-Mufrad,12,23,"Ibn 'Abbas mentioned the words of the Almighty, ""When one or both of them reach old age with you, do not say 'Ugh!' to them out of irritation and do not be harsh with them but speak to them with gentleness and generosity. Take them under your wing, out of mercy, with due humility and say: 'Lord, show mercy to them as they did in looking after me when I was small."" (17:23-24) He said, ""This was abrogated in Surat at-Tawba: 'It is not right for the Prophet (ﷺ) and those who have iman to ask forgiveness for the mushrikun even if they are close relatives after it has become clear to them that they are the Companions of the Blazing Fire.' (9:113)""",Al-Albani,Hasan
adab24,adab,1,Al-Adab Al-Mufrad,13,24,"Sa'id ibn Abi Waqqas said: ""Four ayats were revealed about me. The first was when my mother swore she would neither eat nor drink until I left Muhammad, may Allah bless him and grant him peace. Allah Almighty revealed, 'But if they try to make you associate something with Me about which you have no knowledge, do not obey them. Keep company with them correctly and courteously in this world' (31:15) The second was when I took a sword that I admired and said, 'Messenger of Allah, give me this!' Then the ayat was revealed: 'They will ask you about booty.' (8:1) The third was when I was ill and the Messenger of Allah, may Allah bless him and grant him peace, came to me and I said, 'Messenger of Allah, I want to divide my property. Can I will away a half?' He said, 'No.' 'A third?' I asked. He was silent and so after that it was allowed to will away a third. The fourth was when I had been drinking wine with some of the Ansar. One of them hit my nose with the jawbone of a camel. I went to the Prophet, may Allah bless him and grant him peace, and Allah Almighty revealed the prohibition of wine.""",Al-Albani,Sahih
adab25,adab,1,Al-Adab Al-Mufrad,13,25,"Asma' bint Abi Bakr said, ""In the time of the Prophet, may Allah bless him and grant him peace, my mother came to me hoping (I would be dutiful). I asked the Prophet, may Allah bless him and grant him peace, 'Do I have to treat her well?' 'Yes,' he replied.""",Al-Albani,Sahih
adab26,adab,1,Al-Adab Al-Mufrad,13,26,"Ibn 'Umar said, ""'Umar saw a silk robe for sale. He said, 'Messenger of Allah, would you buy this robe and wear it on Jumu'a and when delegations visit you?' He replied, 'Only a person who has no portion in the Next World could wear this.' Then the Messenger of Allah, may Allah bless him and grant him peace, was given some robes made of the same material. He sent one of the robes to 'Umar. 'Umar exclaimed, 'How can I wear it when you said what you said about it?' The Prophet (ﷺ) replied, 'I did not give it to you so that you could wear it. You can sell it or give it to someone.' 'Umar sent it to a brother of his in Makka who had not yet become Muslim.""",Al-Albani,Sahih
adab27,adab,1,Al-Adab Al-Mufrad,14,27,"Abdullah ibn 'Amr said that the Prophet, may Allah bless him and grant him peace, said, ""Reviling one's parents is one of the great wrong actions."" They asked, ""How could he revile them?"" He said, ""He reviles a man who then in turn reviles his mother and father.""",Al-Albani,Sahih
adab28,adab,1,Al-Adab Al-Mufrad,14,28,"Abdullah ibn 'Amr said, ""A man's reviling his father is one of the major wrong actions in the sight of Allah Almighty.""",Al-Albani,Hasan
adab29,adab,1,Al-Adab Al-Mufrad,15,29,"Abu Bakra reported that the Prophet, may Allah bless him and grant him peace, said, ""There is no wrong action more likely to bring punishment in this world in addition to what is stored up in the Next World than oppression and severing ties of kinship.""",Al-Albani,Sahih
adab30,adab,1,Al-Adab Al-Mufrad,15,30,"Imran ibn Husayn said, ""The Messenger of Allah, may Allah bless him and grant him peace, said, 'What do you say about fornication, drinking wine and theft?' 'Allah and His Messenger know best,' we replied. He stated, 'They are acts of outrage and there is punishment for them, but shall I tell you which is the greatest of the great wrong actions? Associating with Allah Almighty and disobeying parents.' He had been reclining, but then he sat up and said, 'and lying.'""",Al-Albani,Da'if
adab31,adab,1,Al-Adab Al-Mufrad,16,31,"Ibn 'Umar said, ""Making parents weep is part of disobedience and one of the major wrong actions.""",Al-Albani,Sahih
adab32,adab,1,Al-Adab Al-Mufrad,17,32,"Abu Hurayra reported that the Prophet, may Allah bless him and grant him peace, said, ""Three supplications are answered without a doubt: the supplication of someone who is oppressed, the supplication of someone on a journey, and the supplication of parents for their children.""",Al-Albani,Hasan
adab33,adab,1,Al-Adab Al-Mufrad,17,33,"Abu Hurayra reported that he heard the Messenger of Allah, may Allah bless him and grant him peace, say, ""No human child has ever spoken in the cradle except for 'Isa ibn Maryam, may Allah bless him and grant him peace, and the companion of Jurayj."" Abu Hurayra asked, ""Prophet of Allah, who was the companion of Jurayj?"" The Prophet (ﷺ) replied, ""Jurayj was a monk who lived in a hermitage. There was a cowherd who used to come to the foot of his hermitage and a woman from the village used to come to the cowherd.",Al-Albani,Sahih
adab34,adab,1,Al-Adab Al-Mufrad,18,34,"Abu Hurayra said, ""Neither Jew nor Christian has heard me and then not loved me. I wanted my mother to become Muslim, but she refused. I told her about it and she still refused. I went to the Prophet, may Allah bless him and grant him peace, and said, 'Pray to Allah for me.' He did so and I went to her. She was inside the door of the house and said, 'Abu Hurayra, I have become Muslim.' I told the Prophet, may Allah bless him and grant him peace, and I asked, 'Make supplication to Allah for me and my mother.' He said, 'O Allah, make people love Abu Hurayra and his mother.'""",Al-Albani,Hasan
adab35,adab,1,Al-Adab Al-Mufrad,19,35,"Abu Usayd said, ""We were with the Messenger of Allah, may Allah bless him and grant him peace, when a man asked, 'Messenger of Allah, is there any act of dutifulness which I can do for my parents after their death?' He replied, 'Yes. There are four things: Supplication for them, asking forgiveness for them, fulfilling their pledges, and being generous to friends of theirs. You only have ties of kinship through your parents.""",Al-Albani,Da'if
adab36,adab,1,Al-Adab Al-Mufrad,19,36,"Abu Hurayra said, ""The dead person can be raised a degree after his death. He said, 'My Lord, how is this?' He was told, 'Your child can ask for forgiveness for you.'""",Al-Albani,Hasan
adab37,adab,1,Al-Adab Al-Mufrad,19,37,"Ibn Sirin said, ""We were with Abu Hurayra one night and he said, 'O Allah, forgive Abu Hurayra and his mother and whoever asks for forgiveness for both of them.'"" Muhammad said, ""We used to ask for forgiveness for them so that we would be included in Abu Hurayra's supplication.""",Al-Albani,Sahih
adab38,adab,1,Al-Adab Al-Mufrad,19,38,"Abu Hurayra reported that the Messenger of Allah, may Allah bless him and grant him peace, said, ""When a person dies, all action is cut off for him with the exception of three things: sadaqa which continues, knowledge which benefits, or a righteous child who makes supplication for him.""",Al-Albani,Sahih
adab39,adab,1,Al-Adab Al-Mufrad,19,39,"Ibn 'Abbas reported that a man said, ""Messenger of Allah, my mother died without a will. Will it help her if I give sadaqa on her behalf?"" ""Yes,"" he replied.",Al-Albani,Sahih
adab40,adab,1,Al-Adab Al-Mufrad,20,40,"Abdullah ibn Dinar reported that Ibn 'Umar passed by a bedouin during a journey. The bedouin's father had been a friend of 'Umar's. The bedouin said, ""Am I not the son of so-and-so?"" He said, ""Yes, indeed."" Ibn 'Umar ordered that he be given a donkey which was following him. He also took off his turban and gave it to him, One of the men with him said, ""Wouldn't two dirhams be enough for him?"" He replied, ""The Prophet, may Allah bless him and grant him peace, said, 'Maintain what your father loved. Do not cut it off so that Allah puts out your light.""",Al-Albani,Da'if
adab41,adab,1,Al-Adab Al-Mufrad,20,41,"Ibn 'Umar reported that the Messenger of Allah, may Allah bless him and grant him peace, said, ""The strongest form of dutifulness is when a man maintains relations with the people his father loved.""",Al-Albani,Sahih
adab42,adab,1,Al-Adab Al-Mufrad,21,42,"Sa'd ibn 'Ubada az-Zurqi reported that his father said, ""I was sitting in the mosque in Madina with 'Amr ibn 'Uthman when 'Abdullah ibn Salam walked by, leaning on his nephew. 'Amr left the assembly and showed his concern for him."" Then Ibn Salam returned to them and said, ""Do what you like, 'Amr ibn 'Uthman,"" (and he said it two or three times) By the One who sent Muhammad, may Allah bless him and grant him peace, with the Truth, it is in the Book of Allah Almighty (and he said it twice), 'Do not cut off those your father has joined so that that extinguishes your light.'""",Al-Albani,Da'if
adab43,adab,1,Al-Adab Al-Mufrad,22,43,"Abu Bakr ibn Hazm reported that one of the Companions of the Prophet, may Allah bless him and grant him peace, said, ""It is enough that I tell you that the Messenger of Allah, may Allah bless him and grant him peace, said, 'Love is inherited.'""",Al-Albani,Da'if
adab44,adab,1,Al-Adab Al-Mufrad,23,44,"Abu Hurayra saw two men and said to one of them, ""Who is this man in relation to you?"" He is my father,"" he replied. He said, ""Do not call him by his own name nor walk in front of him nor sit down before him.""",Al-Albani,Sahih
adab45,adab,1,Al-Adab Al-Mufrad,24,45,"Shahr ibn Hawshab said, ""We went out with Ibn 'Umar and Salim said to him, 'Peace, Abu 'Abdu'r-Rahman.'""",Al-Albani,Da'if
adab46,adab,1,Al-Adab Al-Mufrad,24,46,"Abdullah ibn Dinar said reported that Ibn 'Umar said, ""But Abu Hafs 'Umar decided...""",Al-Albani,Sahih
adab47,adab,2,Al-Adab Al-Mufrad,25,47,"Kulayb ibn Manfa'a reported that his grandfather asked, ""Messenger of Allah, towards whom should I be dutiful?"" He replied, ""Your mother, your father, your sister and your brother. Then your mawla (client) has the next right against you and then your relatives who are connected.""",Al-Albani,Da'if
adab48,adab,2,Al-Adab Al-Mufrad,25,48,"Abu Hurayra said, ""When the following ayat was revealed ('Warn your near relatives' (26:214)), the Prophet, may Allah bless him and grant him peace, stood up and called out, saying, 'Banu Ka'b ibn Lu'ayy! Save yourselves from the Fire! Banu 'Abdu Manaf! Save yourselves from the Fire! Banu Hashim! Save yourselves from the Fire! Banu 'Abdu'l-Muttalib! Save yourselves from the Fire! Fatima, daughter of Muhammad! Save yourselves from the Fire! I do not have anything for you in respect to Allah except for the fact that you have ties of kinship.'""",Al-Albani,Sahih
adab49,adab,2,Al-Adab Al-Mufrad,26,49,"Abu Ayyub al-Ansari told him that a bedouin came to the Prophet, may Allah bless him and grant him peace, while he was travelling. He asked, ""Tell me what will bring me near to the Garden and keep me far from the Fire."" He replied, ""Worship Allah and do not associate anything with Him, perform the prayer, pay zakat, and maintain ties of kinship.""",Al-Albani,Sahih
adab50,adab,2,Al-Adab Al-Mufrad,26,50,"Abu Hurayra reported that the Messenger of Allah, may Allah bless him and grant him peace, said, ""Allah Almighty created creation. When He had finished it, ties of kinship rose up. Allah said, 'Stop!' They said, 'This is the place for anyone seeking refuge with You from being cut off' Allah said, 'Are you not content that I should maintain connections with the one who maintains connection with you and I should cut off the one who cuts you off?' It replied, 'Yes indeed, my Lord.' He said, 'You have that.'""",Al-Albani,Sahih
adab51,adab,2,Al-Adab Al-Mufrad,26,51,"Ibn 'Abbas spoke about the ayat, ""Give your relatives their due, and the very poor and travellers"" (17:26), and said, ""He begins by commanding the most pressing of the obligatory dues and He directs us to the best action if we have any money. He says: 'Give your relatives their due, and the very poor and travellers.' He also teaches us what we can say if we have nothing. He says, 'But if you do turn away from them, seeking the mercy you hope for from your Lord, then speak to them with words that bring them ease' (17:28) in the form of an excellent promise. Things are as they are, but they might change if Allah wills. 'Do not keep your hand chained to your neck' and not give anything, 'but do not extend it either to its full extent' and give all you have, 'so that you sit there blamed' as those who come to you later and find you have nothing will blame you, 'and destitute.' (17:29)"" He said, ""The person to whom you have given everything has made you destitute.""",Al-Albani,Da'if
adab52,adab,2,Al-Adab Al-Mufrad,27,52,"Abu Hurayra said, ""A man came to the Prophet, may Allah bless him and grant him peace, and said, 'Messenger of Allah! I have relatives with whom I maintain ties while they cut me off. I am good to them while they are bad to me. They behave foolishly towards me while I am forbearing towards them.' The Prophet (ﷺ) said, 'If things are as you said, it is as if you were putting hot ashes on them and you will not lack a supporter against them from Allah as long as you continue to do that.'""",Al-Albani,Sahih
adab53,adab,2,Al-Adab Al-Mufrad,27,53,"Abdu'r-Rahman ibn 'Awf heard the Messenger of Allah, may Allah bless him and grant him peace, say, ""Allah, the Almighty and Exalted, said, 'I am the Merciful (ar-Rahman). I have created ties of kinship and derives a name for it from My Name. If anyone maintains ties of kinship, I maintain connection with him, and I shall cut off anyone who cuts them off.'""",Al-Albani,Sahih
adab54,adab,2,Al-Adab Al-Mufrad,27,54,"Abu'l-'Anbas said, ""I visited 'Abdullah ibn 'Amr at al-Waht (some land of his in Ta'if). He said, 'The Prophet, may Allah bless him and grant him peace, pointed his finger towards us and said, ""Kinship (rahim) us derived from the All-Merciful (Rahman). When someone maintains the connections of ties of kinship, they maintain connection with him. If someone cuts them off, they cut him off. They will have an unfettered, eloquent tongue on the Day of Rising.""'""",Al-Albani,Sahih
adab55,adab,2,Al-Adab Al-Mufrad,27,55,"A'isha reported that the Prophet, may Allah bless him and grant him peace, said, ""Kinship (rahim) is derived from Allah. If anyone maintains ties of kinship Allah maintains ties with him. If anyone cuts them off, Allah cuts him off.""",Al-Albani,Sahih
adab56,adab,2,Al-Adab Al-Mufrad,28,56,"Anas ibn Malik reported that the Messenger of Allah, may Allah bless him and grant him peace, said, ""Anyone who wants to have his provision expanded and his term of life prolonged should maintain ties of kinship.""",Al-Albani,Sahih
adab57,adab,2,Al-Adab Al-Mufrad,28,57,"Abu Hurayra heard that the Messenger of Allah, may Allah bless him and grant him peace, say, ""Anyone who wants to have his provision expanded and his term of life lengthened should maintain ties of kinship.""",Al-Albani,Sahih
adab58,adab,2,Al-Adab Al-Mufrad,29,58,"Ibn 'Umar said, ""If someone fears his Lord and maintains ties of kinship, his term of life will be prolonged, he will have abundant wealth and his people will love him.""",Al-Albani,Hasan
adab59,adab,2,Al-Adab Al-Mufrad,29,59,"Ibn 'Umar said, ""Whoever has taqwa of his Lord and maintains ties of kinship, his term of life will be prolonged, his wealth will be abundant, and his family will love him.""",Al-Albani,Hasan
